{
  "schema_version": 2,
  "observed_at_commit": "5130d139db4db4ba0246744fbd8058df9853d005",
  "id_policy": {
    "canonical_system_pattern": "^GSI-[0-9]{2}\\.[0-9]{2}$",
    "slice_pattern": "^SLICE-[0-9]{8}-[A-Z0-9-]+$",
    "loop_pattern": "^LOOP-[0-9]{3}-[A-Z0-9-]+$",
    "edge_pattern": "^EDGE-[0-9]{4}-[A-Z0-9-]+$",
    "rule": "Implementation slices never create or extend canonical GSI IDs."
  },
  "legacy_slice_aliases": [
    {
      "legacy_id": "GSI-04.03A",
      "slice_id": "SLICE-20260724-OVERLAY-TIBERIUM-CLASSIFIER",
      "canonical_systems": ["GSI-04.09"],
      "reason": "The historical suffix described overlay-to-tiberium classification; canonical GSI-04.03 is elevation, ramps, cliffs, slopes, and height conversion.",
      "evidence": [
        "docs/contracts/2026-07-24-gsi-04-03a-overlay-to-tiberium-index-implementation-contract.md",
        "docs/research/GAMEMD_SYSTEM_INVENTORY_COVERAGE_MAP_GHIDRA_REPORT.md:267",
        "docs/research/GAMEMD_SYSTEM_INVENTORY_COVERAGE_MAP_GHIDRA_REPORT.md:273"
      ]
    },
    {
      "legacy_id": "GSI-04.03B",
      "slice_id": "SLICE-20260724-MERGED-RULES-OVERLAY-AUTHORITY",
      "canonical_systems": ["GSI-02.03", "GSI-02.04", "GSI-04.09"],
      "reason": "The historical suffix described merged-rules registry authority supporting overlay identity, not an elevation child system.",
      "evidence": [
        "docs/contracts/2026-07-24-gsi-04-03b-merged-rules-overlay-registry-authority-implementation-contract.md",
        "docs/research/GAMEMD_SYSTEM_INVENTORY_COVERAGE_MAP_GHIDRA_REPORT.md:267",
        "docs/research/GAMEMD_SYSTEM_INVENTORY_COVERAGE_MAP_GHIDRA_REPORT.md:273"
      ]
    }
  ],
  "systems": {
    "GSI-01.05": {
      "native_anchors": [
        {
          "symbol": "LogicClass::PerTickUpdate",
          "address": "0x0055AFB0",
          "evidence": "docs/research/core-services-map/logicclass.md"
        }
      ],
      "rust_surfaces": [
        {
          "path": "src/sim/world/mod.rs",
          "symbol": "Simulation::advance_tick",
          "coverage": "representative",
          "observed_at_commit": "5130d139db4db4ba0246744fbd8058df9853d005"
        }
      ],
      "notes": ["Global scheduler and active-object order are load-bearing consumers of almost every gameplay loop."]
    },
    "GSI-03.10": {
      "native_anchors": [
        {
          "symbol": "skirmish start acceptance path",
          "address": "0x006ACEE0",
          "evidence": "docs/research/SKIRMISH_START_TO_LOADING_SCREEN_ACTIVATION_GHIDRA_REPORT.md"
        }
      ],
      "rust_surfaces": [
        {
          "path": "src/skirmish_launch.rs",
          "symbol": "build_skirmish_launch",
          "coverage": "representative",
          "observed_at_commit": "5130d139db4db4ba0246744fbd8058df9853d005"
        },
        {
          "path": "src/app_skirmish_session.rs",
          "symbol": "skirmish session launch",
          "coverage": "representative",
          "observed_at_commit": "5130d139db4db4ba0246744fbd8058df9853d005"
        }
      ],
      "notes": ["Owner of the bootstrap skirmish-launch loop."]
    },
    "GSI-06.13": {
      "native_anchors": [
        {
          "symbol": "DriveLocomotionClass::Process",
          "address": "0x004B0500",
          "evidence": "docs/research/DRIVE_PROCESS_MOVEMENT_TICK_ORDER_GHIDRA_REPORT.md"
        },
        {
          "symbol": "Process_Movement",
          "address": "0x004B2630",
          "evidence": "docs/research/DRIVE_PROCESS_MOVEMENT_TICK_ORDER_GHIDRA_REPORT.md"
        }
      ],
      "rust_surfaces": [
        {
          "path": "src/sim/movement/drive_locomotion.rs",
          "symbol": "drive locomotion",
          "coverage": "representative",
          "observed_at_commit": "5130d139db4db4ba0246744fbd8058df9853d005"
        },
        {
          "path": "src/sim/movement/movement_tick.rs",
          "symbol": "tick_movement_with_grids",
          "coverage": "representative",
          "observed_at_commit": "5130d139db4db4ba0246744fbd8058df9853d005"
        }
      ],
      "notes": ["Owner of the bootstrap ground-move loop; native executable preflight remains blocked."]
    },
    "GSI-07.13": {
      "native_anchors": [
        {
          "symbol": "InfantryClass::Mission_Capture",
          "address": "0x005202F0",
          "evidence": "docs/research/ENGINEER_CAPTURE_GHIDRA_REPORT.md"
        }
      ],
      "rust_surfaces": [
        {
          "path": "src/sim/world/world_orders.rs",
          "symbol": "tick_capture_orders",
          "coverage": "representative",
          "observed_at_commit": "5130d139db4db4ba0246744fbd8058df9853d005"
        }
      ],
      "notes": ["Engineer mission capture, distinct from CaptureManager mind control."]
    },
    "GSI-07.39": {
      "native_anchors": [
        {
          "symbol": "BuildingClass::Receive_Radio",
          "address": "0x0043C2D0",
          "evidence": "docs/research/miner/STOCK_REFINERY_DOCK_UNLOAD_STATE_MACHINE_CURRENT_SYSTEM_MODEL_SYNTHESIS.md"
        },
        {
          "symbol": "UnitClass::Receive_Radio",
          "address": "0x00737430",
          "evidence": "docs/research/miner/STOCK_REFINERY_DOCK_UNLOAD_STATE_MACHINE_CURRENT_SYSTEM_MODEL_SYNTHESIS.md"
        }
      ],
      "rust_surfaces": [
        {
          "path": "src/sim/miner/miner_dock.rs",
          "symbol": "refinery docking",
          "coverage": "representative",
          "observed_at_commit": "5130d139db4db4ba0246744fbd8058df9853d005"
        },
        {
          "path": "src/sim/miner/miner_dock_sequence.rs",
          "symbol": "dock unload sequence",
          "coverage": "representative",
          "observed_at_commit": "5130d139db4db4ba0246744fbd8058df9853d005"
        }
      ],
      "notes": ["Owner of the full harvest-return-dock-credit closed loop."]
    },
    "GSI-07.41": {
      "native_anchors": [
        {
          "symbol": "BuildingClass::ExitObject_Main",
          "address": "0x00443C60",
          "evidence": "docs/research/GRIZZLY_PRODUCTION_COMPLETE_TO_WAR_FACTORY_EXIT_GHIDRA_REPORT.md"
        }
      ],
      "rust_surfaces": [
        {
          "path": "src/sim/production/production_spawn.rs",
          "symbol": "production spawn",
          "coverage": "representative",
          "observed_at_commit": "5130d139db4db4ba0246744fbd8058df9853d005"
        },
        {
          "path": "src/sim/production/war_factory_exit.rs",
          "symbol": "war factory exit",
          "coverage": "representative",
          "observed_at_commit": "5130d139db4db4ba0246744fbd8058df9853d005"
        }
      ],
      "notes": ["Factory exit and blocked-exit retry are a separate loop from building placement."]
    },
    "GSI-07.42": {
      "native_anchors": [
        {
          "symbol": "CargoClass::AddPassenger",
          "address": "0x004733A0",
          "evidence": "docs/research/GENERIC_TRANSPORT_CARGO_INSERTION_ORDER_GHIDRA_REPORT.md"
        }
      ],
      "rust_surfaces": [
        {
          "path": "src/sim/passenger.rs",
          "symbol": "passenger cargo and unload",
          "coverage": "representative",
          "observed_at_commit": "5130d139db4db4ba0246744fbd8058df9853d005"
        },
        {
          "path": "src/sim/radio",
          "symbol": "transport radio protocol",
          "coverage": "representative",
          "observed_at_commit": "5130d139db4db4ba0246744fbd8058df9853d005"
        }
      ],
      "notes": ["Static evidence records concrete load/unload ordering drift; no native executable loop oracle exists."]
    },
    "GSI-08.10": {
      "native_anchors": [
        {
          "symbol": "TechnoClass::ReceiveDamage",
          "address": "0x00701900",
          "evidence": "docs/research/DAMAGE_SIGNED_VITALITY_WRITER_AND_FATAL_HANDOFF_GHIDRA_REPORT.md"
        },
        {
          "symbol": "ObjectClass::ReceiveDamage",
          "address": "0x005F5390",
          "evidence": "docs/research/DAMAGE_RECEIVER_CORE_REINVESTIGATION_2026-07-13.md"
        }
      ],
      "rust_surfaces": [
        {
          "path": "src/sim/combat/damage",
          "symbol": "damage kernel",
          "coverage": "representative",
          "observed_at_commit": "5130d139db4db4ba0246744fbd8058df9853d005"
        },
        {
          "path": "src/sim/combat/mod.rs",
          "symbol": "tick_combat_with_fog",
          "coverage": "representative",
          "observed_at_commit": "5130d139db4db4ba0246744fbd8058df9853d005"
        }
      ],
      "notes": ["Owner of the attack-through-fatal-damage loop; batch ownership differs from the native live-vector path."]
    },
    "GSI-09.07": {
      "native_anchors": [
        {
          "symbol": "HouseClass::AI_AssessPower",
          "address": "0x00508C30",
          "evidence": "docs/research/POWER_SYSTEM_GHIDRA_REPORT.md"
        },
        {
          "symbol": "HouseClass::UpdateTacticalRadarAvailability",
          "address": "0x00508DF0",
          "evidence": "docs/research/POWER_SYSTEM_GHIDRA_REPORT.md"
        }
      ],
      "rust_surfaces": [
        {
          "path": "src/sim/power_system.rs",
          "symbol": "recalculate_power_for_owner / tick_power_states / has_active_radar",
          "coverage": "representative",
          "observed_at_commit": "84991f1404cd804f1ea8252afe4da3e0943898bd"
        },
        {
          "path": "src/sim/production/production_placement.rs",
          "symbol": "place_ready_building",
          "coverage": "representative",
          "observed_at_commit": "84991f1404cd804f1ea8252afe4da3e0943898bd"
        },
        {
          "path": "src/sim/radar.rs",
          "symbol": "has_radar_for_owner",
          "coverage": "representative",
          "observed_at_commit": "84991f1404cd804f1ea8252afe4da3e0943898bd"
        }
      ],
      "notes": [
        "Power authority feeds radar, sidebar, production, EVA, and multiple same-tick consumers.",